{
  "schemaVersion": 1,
  "runs": [
    {
      "run_id": "sample-aurora-r1",
      "model": "fictional-aurora-clusterer",
      "model_version": "v1",
      "model_config_id": "cfg-k8-cosine",
      "dataset": "support-queries",
      "dataset_version": "2026.01",
      "evaluation_set_id": "eval-core-500",
      "evaluation_config_id": "proto-clustering-v1",
      "run_timestamp": "2026-09-01T12:00:00Z",
      "seed": "seed-11",
      "is_synthetic": true,
      "metric": "ARI",
      "score": 0.62,
      "sample_size": 500,
      "metric_config_id": "mc-cosine-kmeans",
      "latency": 1400,
      "latency_unit": "ms",
      "latency_basis": "run_total",
      "cost": 0.55,
      "cost_currency": "USD",
      "cost_basis": "run_total",
      "cost_provenance": "reported",
      "work_item_count": 500,
      "work_item_unit": "evaluated_query",
      "performance_context_id": "perf-cpu-a"
    },
    {
      "run_id": "sample-aurora-r1",
      "model": "fictional-aurora-clusterer",
      "model_version": "v1",
      "model_config_id": "cfg-k8-cosine",
      "dataset": "support-queries",
      "dataset_version": "2026.01",
      "evaluation_set_id": "eval-core-500",
      "evaluation_config_id": "proto-clustering-v1",
      "run_timestamp": "2026-09-01T12:00:00Z",
      "seed": "seed-11",
      "is_synthetic": true,
      "metric": "NMI",
      "score": 0.71,
      "sample_size": 500,
      "metric_config_id": "mc-cosine-kmeans",
      "latency": 1400,
      "latency_unit": "ms",
      "latency_basis": "run_total",
      "cost": 0.55,
      "cost_currency": "USD",
      "cost_basis": "run_total",
      "cost_provenance": "reported",
      "work_item_count": 500,
      "work_item_unit": "evaluated_query",
      "performance_context_id": "perf-cpu-a"
    },
    {
      "run_id": "sample-borealis-r1",
      "model": "fictional-borealis-clusterer",
      "model_version": "v1",
      "model_config_id": "cfg-k12-euclid",
      "dataset": "support-queries",
      "dataset_version": "2026.01",
      "evaluation_set_id": "eval-core-500",
      "evaluation_config_id": "proto-clustering-v1",
      "run_timestamp": "2026-09-01T13:00:00Z",
      "seed": "seed-11",
      "is_synthetic": true,
      "metric": "ARI",
      "score": 0.55,
      "sample_size": 500,
      "metric_config_id": "mc-cosine-kmeans",
      "latency": 900,
      "latency_unit": "ms",
      "latency_basis": "run_total",
      "cost": 0.28,
      "cost_currency": "USD",
      "cost_basis": "run_total",
      "cost_provenance": "reported",
      "work_item_count": 500,
      "work_item_unit": "evaluated_query",
      "performance_context_id": "perf-cpu-a"
    }
  ],
  "examples": [
    {
      "run_id": "sample-aurora-r1",
      "example_id": "q-001",
      "query_text": "reset my password for the billing portal",
      "predicted_cluster_id": "c-auth",
      "reference_cluster_id": "r-auth",
      "latency_ms": 12,
      "cost": null,
      "cost_currency": null
    }
  ],
  "metricDefinitions": []
}
